{
  "$schema": "codex_wire_audit_v11_schemas/evolution-contract.schema.json",
  "coverage_profile": "fixture",
  "diagnostic_refs": [
    "diag.legacy_combined_identity_gate_observed.1b4118268b59"
  ],
  "diagnostic_summary": {
    "error": 0,
    "info": 1,
    "warning": 0
  },
  "extractors": {
    "extractor.turn_metadata": {
      "data": {
        "construction_function": "CodexResponsesMetadata::turn_metadata_payload",
        "field_groups": {
          "compaction": [
            "compaction"
          ],
          "execution_context": [
            "auto_review_enabled",
            "node_repl_auto_review_required",
            "node_repl_disabled",
            "sandbox",
            "sandbox_mode",
            "workspaces"
          ],
          "flattened_extra": [
            "extra"
          ],
          "lineage": [
            "forked_from_ordinal_exclusive",
            "forked_from_thread_id",
            "parent_thread_id",
            "parent_turn_id",
            "root_turn_id",
            "subagent_kind",
            "thread_source",
            "turn_trigger"
          ],
          "request_identity": [
            "context_window_id",
            "installation_id",
            "request_kind",
            "window_id",
            "window_number"
          ],
          "thread_identity": [
            "agent_name",
            "session_id",
            "thread_id"
          ],
          "timing_and_history": [
            "history_ingest_requested",
            "turn_started_at_unix_ms"
          ],
          "tool_inventory": [
            "tool_namespaces_info"
          ],
          "turn_identity": [
            "turn_id"
          ]
        },
        "field_order": [
          "installation_id",
          "session_id",
          "thread_id",
          "agent_name",
          "turn_id",
          "window_id",
          "window_number",
          "context_window_id",
          "request_kind",
          "forked_from_thread_id",
          "forked_from_ordinal_exclusive",
          "parent_thread_id",
          "parent_turn_id",
          "root_turn_id",
          "subagent_kind",
          "thread_source",
          "turn_trigger",
          "sandbox",
          "sandbox_mode",
          "auto_review_enabled",
          "node_repl_auto_review_required",
          "node_repl_disabled",
          "workspaces",
          "tool_namespaces_info",
          "turn_started_at_unix_ms",
          "history_ingest_requested",
          "compaction",
          "extra"
        ],
        "fields": {
          "agent_name": {
            "emission_fingerprint": "5b78edac99741a1450fdf63cefae80f382cc00babe09bc5d3d4ed364be1b5420",
            "field_name": "agent_name",
            "gate_refs": [
              "turn_metadata.gate.has_turn_identity"
            ],
            "id": "turn_metadata.field.agent_name",
            "identity_domain": "thread_identity",
            "kind": "conditional_option_passthrough",
            "machine_evaluable": true,
            "predicate": {
              "name": "has_turn_identity",
              "op": "var"
            },
            "semantic_fingerprint": "1bf2ba962d3d8f36f45c24276f7186f3d7f821ed354e0a46cab7e3658b814abc",
            "source_expression": "has_turn_identity.then_some(self.agent_name.as_deref()).flatten()",
            "source_ref": "codex-rs/core/src/responses_metadata.rs:16",
            "value_expression": "self.agent_name.as_deref()"
          },
          "auto_review_enabled": {
            "emission_fingerprint": "9d3ea2211b17e91d3d270a7455b175f738a68f6ca4d37f3375fd28440aac7ff8",
            "field_name": "auto_review_enabled",
            "gate_refs": [],
            "id": "turn_metadata.field.auto_review_enabled",
            "identity_domain": "execution_context",
            "kind": "value_passthrough",
            "machine_evaluable": true,
            "predicate": {
              "op": "const",
              "value": true
            },
            "semantic_fingerprint": "5e5e2c4c426624a62f89a01c99cf6af286763bd34029b90dae6b1733ef6ce1ba",
            "source_expression": "self.auto_review_enabled",
            "source_ref": "codex-rs/core/src/responses_metadata.rs:32",
            "value_expression": "self.auto_review_enabled"
          },
          "compaction": {
            "emission_fingerprint": "fd9b8735b9a34d6ccdc24f56b96a0359b9fe3e8f846b8f1973a70d4f2d79bd15",
            "field_name": "compaction",
            "gate_refs": [],
            "id": "turn_metadata.field.compaction",
            "identity_domain": "compaction",
            "kind": "derived_local",
            "machine_evaluable": true,
            "predicate": {
              "op": "const",
              "value": true
            },
            "semantic_fingerprint": "7a38716d5932b48c0bd921507c4949d03c8a69b32ea24121cc3ccfb5bf451497",
            "source_expression": "compaction",
            "source_ref": "codex-rs/core/src/responses_metadata.rs:39",
            "value_expression": "compaction"
          },
          "context_window_id": {
            "emission_fingerprint": "75c01492e0a31ed2866109298fef13a34a54493637d97d1ddbb70f6ce82ff11c",
            "field_name": "context_window_id",
            "gate_refs": [
              "turn_metadata.gate.has_request_identity"
            ],
            "id": "turn_metadata.field.context_window_id",
            "identity_domain": "request_identity",
            "kind": "conditional_option_passthrough",
            "machine_evaluable": true,
            "predicate": {
              "name": "has_request_identity",
              "op": "var"
            },
            "semantic_fingerprint": "01ffbcdd1d1d0badc9ef62526f1080761af9aa0438c7b8407abc0d9a0b3e864c",
            "source_expression": "has_request_identity.then_some(self.context_window_id).flatten()",
            "source_ref": "codex-rs/core/src/responses_metadata.rs:20",
            "value_expression": "self.context_window_id"
          },
          "extra": {
            "emission_fingerprint": "dee2edcfb951c836673e37b49ea5d32e9e409e776507f78aa981642bdac2f7c2",
            "field_name": "extra",
            "gate_refs": [],
            "id": "turn_metadata.field.extra",
            "identity_domain": "flattened_extra",
            "kind": "flattened_extra",
            "machine_evaluable": true,
            "predicate": {
              "op": "const",
              "value": true
            },
            "semantic_fingerprint": "0c18ecf17f7f60cf150c49b3225398c9e37fb7b4fc85b60009b429b22ff74cda",
            "source_expression": "&self.extra",
            "source_ref": "codex-rs/core/src/responses_metadata.rs:40",
            "value_expression": "&self.extra"
          },
          "forked_from_ordinal_exclusive": {
            "emission_fingerprint": "6d96359659e05c9513dbcad7965c30409ba10c08a04af26c3a8ef69da3316cc2",
            "field_name": "forked_from_ordinal_exclusive",
            "gate_refs": [],
            "id": "turn_metadata.field.forked_from_ordinal_exclusive",
            "identity_domain": "lineage",
            "kind": "value_passthrough",
            "machine_evaluable": true,
            "predicate": {
              "op": "const",
              "value": true
            },
            "semantic_fingerprint": "faa60bef0f5f74e1c1ad59f2d7ac8b414db7825476008fdd58e59070420e5ce8",
            "source_expression": "self.forked_from_ordinal_exclusive",
            "source_ref": "codex-rs/core/src/responses_metadata.rs:23",
            "value_expression": "self.forked_from_ordinal_exclusive"
          },
          "forked_from_thread_id": {
            "emission_fingerprint": "8569c8346f8161a84feddc621df9a5e93b922a28affa853f3be9948efb9a8f51",
            "field_name": "forked_from_thread_id",
            "gate_refs": [],
            "id": "turn_metadata.field.forked_from_thread_id",
            "identity_domain": "lineage",
            "kind": "value_passthrough",
            "machine_evaluable": true,
            "predicate": {
              "op": "const",
              "value": true
            },
            "semantic_fingerprint": "f946d2f724d2e243396062ba79008a48ed64813ced588fb8e2a77819bd071c41",
            "source_expression": "self.forked_from_thread_id",
            "source_ref": "codex-rs/core/src/responses_metadata.rs:22",
            "value_expression": "self.forked_from_thread_id"
          },
          "history_ingest_requested": {
            "emission_fingerprint": "271e6fa03ab909a95e01c1e29b793782dfa27af7f19f6e2634186058ccd68f92",
            "field_name": "history_ingest_requested",
            "gate_refs": [],
            "id": "turn_metadata.field.history_ingest_requested",
            "identity_domain": "timing_and_history",
            "kind": "value_passthrough",
            "machine_evaluable": true,
            "predicate": {
              "op": "const",
              "value": true
            },
            "semantic_fingerprint": "c3e073a1586bac2856cc5d45cfa6e33aab20949cda3a1105d7699abcbe8f998e",
            "source_expression": "self.history_ingest_requested",
            "source_ref": "codex-rs/core/src/responses_metadata.rs:38",
            "value_expression": "self.history_ingest_requested"
          },
          "installation_id": {
            "emission_fingerprint": "9162f4afa8ad8f8fee61c2b545f6a655e763e851e623baf0fd2038c05c8da7e7",
            "field_name": "installation_id",
            "gate_refs": [
              "turn_metadata.gate.has_request_identity"
            ],
            "id": "turn_metadata.field.installation_id",
            "identity_domain": "request_identity",
            "kind": "conditional_value",
            "machine_evaluable": true,
            "predicate": {
              "name": "has_request_identity",
              "op": "var"
            },
            "semantic_fingerprint": "ebafbe8da6c22a0840e0f1c234b80bfc873bb8b9aa48cc631ec4269d38b99eef",